question,category,options,answer,explanation
医療安全における「タイムアウト」の実施について正しい記述はどれか。2つ選べ。,a.処置開始直前にチーム全員で手を止めて行う|b.患者氏名・部位・術式などを声出し確認する|c.医師が一人で黙認すればよい|d.検査終了後に行うものである|e.緊急時は省略してよい,a&b,誤認防止のため、処置直前に全員で作業を中断し、対象患者と実施内容を共有確認するプロセスです。
コールドポリペクトミー（CSP）の特徴として正しい記述はどれか。2つ選べ。,a.高周波通電を行わないため熱損傷がない|b.遅発性出血や穿孔のリスクが低い|c.ペースメーカー患者には禁忌である|d.20mm以上の大きな病変に適している|e.クリップ縫縮が必須である,a&b,CSPは機械的切除のみを行うため、深部熱損傷による穿孔や遅発性出血が少なく、抗血栓薬服用者やペースメーカー患者にも安全に施行可能です。主に10mm未満が適応。
超音波内視鏡（EUS）の方式と特徴について正しい記述はどれか。2つ選べ。,a.ラジアル走査式は360度の全周画像が得られる|b.コンベックス走査式は穿刺吸引術（FNA）が可能である|c.ラジアル走査式は穿刺針の誘導に最適である|d.コンベックス走査式は視野が360度である|e.リニア走査式は消化管では使用されない,a&b,ラジアルは全周観察（スクリーニング）、コンベックス（セクタ）は断層面と穿刺ラインが一致するためFNAに適しています。
カプセル内視鏡検査が禁忌となる患者はどれか。2つ選べ。,a.消化管の狭窄や閉塞が疑われる患者|b.心臓ペースメーカー植込み患者（機種によるが原則確認）|c.小児患者|d.嚥下可能な高齢者|e.消化管出血の患者,a&b,カプセル滞留による腸閉塞リスクがある狭窄例は禁忌です。ペースメーカーは干渉の可能性があるため、対応機種かどうかの確認が必要です。
大腸憩室症について正しい記述はどれか。2つ選べ。,a.S状結腸に好発する|b.出血や憩室炎の原因となる|c.先天性の真性憩室が多い|d.ポリープ切除の適応となる|e.必ず癌化する,a&b,大腸憩室は後天性の仮性憩室が多く、内圧の高いS状結腸に好発します。憩室出血や憩室炎、穿孔などの合併症を起こすことがあります。
内視鏡的乳頭括約筋切開術（EST）の切開方向として推奨されるのはどれか。2つ選べ。,a.11時方向|b.12時方向|c.3時方向|d.6時方向|e.9時方向,a&b,乳頭の解剖学的構造（膵管・血管の走行）から、出血や穿孔、膵炎のリスクが最も低い「11時〜12時方向（口側）」への切開が推奨されています。
特殊光観察（NBI/BLI等）で強調される構造はどれか。2つ選べ。,a.粘膜表層の微細血管|b.粘膜表面の微細構造（ピットパターン等）|c.粘膜下層の深部血管|d.脂肪組織|e.固有筋層の厚み,a&b,短波長の狭帯域光は粘膜表層で吸収・散乱されるため、表層の毛細血管や微細な表面構造のコントラストを強調し、癌の早期発見に有用です。
経皮内視鏡的胃瘻造設術（PEG）の禁忌となる病態はどれか。2つ選べ。,a.大量の腹水貯留|b.内視鏡が通過できない咽頭・食道狭窄|c.脳血管障害後遺症|d.認知症による摂食障害|e.神経難病による嚥下障害,a&b,胃壁と腹壁を密着できない大量腹水例や、そもそも胃内にスコープを挿入できない狭窄例は造設不可能です。c,d,eは造設の適応となりえます。
消毒薬「過酢酸」の特徴として正しい記述はどれか。2つ選べ。,a.分解産物は水・酸素・酢酸であり無害である|b.タンパク凝固作用がない|c.金属腐食性が非常に強い|d.芽胞には無効である|e.使用時に遮光が必要である,a&b,過酢酸は環境負荷が低く、タンパク凝固作用がないため洗浄性に優れます。高水準消毒薬として芽胞にも有効です。
ヘリコバクター・ピロリの検査法で、内視鏡を用いない（非侵襲的）ものはどれか。2つ選べ。,a.尿素呼気試験|b.便中抗原測定|c.迅速ウレアーゼ試験|d.鏡検法|e.培養法,a&b,呼気試験や便・尿・血液検査は非侵襲的です。c,d,eは内視鏡で組織を採取する必要があります。
消化管の「粘膜筋板」に関する記述で正しいものはどれか。2つ選べ。,a.粘膜層の最下層に位置する|b.食道癌や胃癌の深達度判定（M/SM）の基準となる|c.固有筋層よりも厚い|d.神経叢が豊富に存在する|e.漿膜の直下にある,a&b,粘膜筋板は粘膜固有層と粘膜下層の間にある薄い筋層で、癌がこれを超えているか（SM浸潤）が治療方針（内視鏡か手術か）の重要な境目になります。
内視鏡室の感染対策（ゾーニング）について正しい記述はどれか。2つ選べ。,a.洗浄室は汚染区域とみなす|b.個人防護具（PPE）は汚染区域から出る際に外す|c.清潔区域と汚染区域の動線を交差させる|d.使用済みスコープは処置室で洗浄・消毒を完了する|e.休憩室でPPEを着用する,a&b,洗浄室は汚染区域です。PPEは汚染を拡散させないよう、汚染区域内で脱いでから退出します。
十二指腸の解剖について正しい記述はどれか。2つ選べ。,a.球部・下行部・水平部・上行部に区分される|b.ファーター乳頭は下行部に開口する|c.全域が腹膜内器官である|d.空腸よりケルクリングひだが発達している|e.胃酸を分泌する,a&b,十二指腸はC字型をしており、球部以外は腹膜後器官です。胆汁・膵液が出るファーター乳頭は下行部にあります。
局所麻酔薬リドカインの中毒症状として正しいものはどれか。2つ選べ。,a.初期に多弁、興奮、舌のしびれが現れる|b.進行すると意識消失、徐脈、呼吸停止に至る|c.血圧が急上昇し続ける|d.皮膚に発疹が出る（アレルギー症状）|e.高熱が出る,a&b,リドカイン中毒は血中濃度上昇による中枢神経症状（興奮→抑制）と循環抑制が特徴です。アナフィラキシー（発疹、ショック）とは区別が必要です。
食道癌のスクリーニングにおけるヨード（ルゴール）染色の判定について正しい記述はどれか。2つ選べ。,a.正常な扁平上皮は濃染する（褐色になる）|b.癌部や異型上皮は不染帯（染まらない）となる|c.癌部は黒色に染まる|d.ヨードは癌細胞に取り込まれる|e.腺癌の診断に有用である,a&b,ヨードは正常細胞内のグリコーゲンと反応します。グリコーゲンが乏しい癌部は染まらず白っぽく（不染帯）見えます。食道腺癌（バレット腺癌）には無効です。
胃底腺ポリープの特徴として正しい記述はどれか。2つ選べ。,a.ピロリ菌陰性の胃粘膜に発生しやすい|b.女性に多い|c.癌化率が非常に高い|d.萎縮性胃炎を背景とする|e.通常は切除が必要である,a&b,胃底腺ポリープはピロリ感染のない綺麗な胃（胃酸分泌過多傾向）に発生しやすく、女性に多い良性ポリープです。癌化は稀で経過観察が基本です。
内視鏡的異物除去において、緊急摘出が必要なものはどれか。2つ選べ。,a.ボタン型電池（食道停滞）|b.鋭利な異物（PTPシート、針など）|c.小さなビー玉（胃内）|d.パチンコ玉（胃内）|e.果物の種,a&b,ボタン電池は放電による穿孔リスクが高く、鋭利な異物は粘膜損傷・穿孔の危険があるため、緊急内視鏡の絶対適応です。丸く小さなものは自然排出を待つこともあります。
機能性ディスペプシア（FD）について正しい記述はどれか。2つ選べ。,a.内視鏡検査で器質的異常を認めない|b.胃もたれや心窩部痛などの症状がある|c.胃癌が原因である|d.必ずピロリ除菌で治癒する|e.手術が必要である,a&b,FDは症状があるにも関わらず、潰瘍や癌などの目に見える異常がない疾患です。酸分泌抑制薬や消化管運動機能改善薬などが用いられます。
内視鏡検査の偶発症である「穿孔」の徴候として正しいものはどれか。2つ選べ。,a.激しい腹痛|b.腹部の板状硬（筋性防御）|c.皮下気腫の出現|d.大量の下血|e.徐脈,a&c,穿孔すると消化液や空気が腹腔内に漏れ、腹膜炎による激痛や筋性防御、および皮下気腫（頸部や胸部など）が生じることがあります。
インフォームド・コンセント（IC）について正しい記述はどれか。2つ選べ。,a.患者が説明を理解し、自由意志で同意すること|b.同意はいつでも撤回可能である|c.医療者が治療方針を独断で決定すること|d.家族への説明だけで十分である|e.同意書にサインしたら撤回できない,a&b,ICは「説明と同意」であり、患者の自己決定権を保障するものです。患者はいつでも同意を撤回できます。
ERCPで使用するガイドワイヤーの役割として正しい記述はどれか。2つ選べ。,a.カテーテルや処置具を目的の胆管・膵管へ誘導する|b.造影後の胆管確保（アククセス維持）を行う|c.結石を破砕する|d.乳頭を切開する|e.胆汁を吸引する,a&b,ガイドワイヤーは「道しるべ」としてカテーテルの挿入を助け、処置具交換時に胆管深部へのアクセスを維持するために不可欠です。
内視鏡室の電気安全管理について正しい記述はどれか。2つ選べ。,a.医用電気機器は3Pプラグ（接地極付き）を使用する|b.漏れ電流によるミクロショック対策を行う|c.アースは接続しなくてよい|d.タコ足配線を推奨する|e.機器の点検は故障してから行う,a&b,患者に直接触れる機器が多いため、漏れ電流による電撃事故を防ぐための接地（アース）と定期点検が必須です。
大腸内視鏡検査の前処置（洗腸）において注意すべき点はどれか。2つ選べ。,a.腸閉塞疑いの患者には禁忌である|b.排便が透明になるまで行う|c.脱水予防のため水分摂取を禁止する|d.前日は高繊維食を摂取する|e.腹痛が出現しても服用を続ける,a&b,閉塞時の洗腸剤投与は穿孔を招きます。観察には便残渣のない透明な排液状態が必要です。異常時は中止します。
胆石の種類と特徴について正しい記述はどれか。2つ選べ。,a.コレステロール結石が最も多い|b.黒色石は溶血性貧血などで見られる|c.ビリルビンカルシウム石は胆嚢内のみにできる|d.脂肪酸カルシウム石が最も多い|e.胆石はすべてX線に写る,a&b,現在日本で最も多いのはコレステロール石です。黒色石はビリルビン過剰（溶血など）で生じます。ビリルビンCa石は胆管内にも生じます。
消化管アミロイドーシスの内視鏡所見はどれか。2つ選べ。,a.微細顆粒状粘膜|b.紫斑や血腫の形成（易出血性）|c.敷石像|d.多発憩室|e.巨大潰瘍,a&b,アミロイド沈着により粘膜が脆くなり、微細顆粒状の変化や、生検・接触による出血（紫斑）が見られるのが特徴です。
内視鏡的止血術のうち「機械的止血法」に分類されるものはどれか。2つ選べ。,a.クリップ法|b.EVL（内視鏡的静脈瘤結紮術）|c.局注法|d.アルゴンプラズマ凝固法|e.ヒータープローブ法,a&b,クリップやゴムバンド（EVL）などの器具で物理的に組織を縛ったり挟んだりする方法です。cは薬剤法、d/eは熱凝固法です。
脂肪肝の超音波（またはEUS）所見として正しい記述はどれか。2つ選べ。,a.肝腎コントラストの増強（肝臓が白く見える）|b.深部減衰（深部が暗くなる）|c.肝表面の凹凸不整|d.門脈の拡張|e.腹水の貯留,a&b,脂肪沈着により肝実質のエコーレベルが上昇して腎臓より白く見え（肝腎コントラスト）、超音波が減衰しやすいため深部が描出しにくくなります。
食道静脈瘤硬化療法（EIS）で使用される硬化剤はどれか。2つ選べ。,a.エタノールアミンオレート（EO）|b.ポリドカスクレロール（Aethoxysklerol）|c.生理食塩水|d.インジゴカルミン|e.ヒアルロン酸ナトリウム,a&b,EISでは血管内皮を障害し血栓閉塞させるために、EOやポリドカスクレロールなどの硬化剤を静脈瘤内に注入します。
小腸の解剖について正しい記述はどれか。2つ選べ。,a.十二指腸・空腸・回腸からなる|b.回腸にはパイエル板（リンパ小節）が多い|c.空腸は回腸より壁が薄い|d.全長は約15mである|e.大部分は後腹膜に固定されている,a&b,小腸の区分と、免疫組織であるパイエル板が回腸に多いことは重要です。全長は6-7m程度。十二指腸以外は腹膜内器官（可動性あり）です。
内視鏡的粘膜切除術（EMR）の手順として正しい記述はどれか。2つ選べ。,a.粘膜下層に生理食塩水等を局注し病変を挙上させる|b.スネアで病変を絞扼し高周波通電で切除する|c.局注せずにそのまま切除する|d.通電せずに引きちぎる|e.病変の表面だけを焼灼する,a&b,EMRは局注による挙上（リフティング）を作り、安全にスネアリングして切除する手技です。局注しない方法はコールドスネア等ですが、EMRの定義は通常局注併用です。
MRI検査における内視鏡関連の禁忌・注意点はどれか。2つ選べ。,a.磁性体を含むクリップの残存|b.カプセル内視鏡の体内滞留|c.チタン製クリップ（非磁性体）|d.プラスチックステント|e.以前の生検歴,a&b,磁性体（鉄など）は磁場で動いたり発熱するため禁忌です。カプセル内視鏡も電子機器・電池を含むため絶対禁忌です。
胃内視鏡検査における「咽頭麻酔」の目的と注意点はどれか。2つ選べ。,a.咽頭反射（オェッとなる反射）を抑制する|b.リドカイン中毒やショックに注意する|c.意識を消失させる|d.胃の蠕動を止める|e.検査後すぐに食事をしてよい,a&b,咽頭の知覚を麻痺させて苦痛と反射を和らげますが、リドカインの吸収による全身毒性（ショック・中毒）のリスク管理が必要です。
胃の解剖と機能について正しい記述はどれか。2つ選べ。,基礎,a.胃体部は胃酸を分泌する壁細胞が豊富である|b.幽門前庭部（アントルム）からはガストリンが分泌される|c.胃角部は大弯側に位置する|d.噴門は第3腰椎の高さにある|e.胃の蠕動運動は副交感神経によって抑制される,a&b,胃体部の胃底腺領域には壁細胞（酸分泌）や主細胞（ペプシン分泌）が分布します。幽門腺領域（前庭部）のG細胞からはガストリンが分泌されます。胃角は小弯側、噴門はTh11付近です。蠕動は副交感神経（迷走神経）で促進されます。
消化管ホルモンとその作用について正しい組み合わせはどれか。2つ選べ。,基礎,a.セクレチン — 膵液（重炭酸イオン）分泌促進|b.コレシストキニン（CCK） — 胆嚢収縮|c.ソマトスタチン — インスリン分泌促進|d.ガストリン — 胃酸分泌抑制|e.モチリン — 消化管運動抑制,a&b,セクレチンはS細胞から分泌され膵液分泌促進・胃酸抑制を行います。CCKはI細胞から分泌され胆嚢収縮・膵酵素分泌を促します。ソマトスタチンは分泌抑制、ガストリンは酸分泌促進、モチリンは空腹期収縮運動（MMC）を誘発します。
肝臓の解剖生理について正しい記述はどれか。2つ選べ。,基礎,a.肝動脈は機能血管であり栄養素を運ぶ|b.門脈は栄養血管であり酸素を運ぶ|c.肝臓は右葉と左葉に分かれる|d.グリソン鞘には門脈・肝動脈・胆管が走る|e.胆汁は胆嚢で作られる,c&d,肝臓は解剖学的に右葉・左葉（さらに尾状葉・方形葉）に分かれます。グリソン鞘（門脈域）には門脈・動脈・胆管の三つ組が走行します。機能血管は門脈、栄養血管は肝動脈です。胆汁は肝細胞で作られます。
ビタミン欠乏症について正しい記述はどれか。2つ選べ。,基礎,a.ビタミンB1欠乏 — 脚気・ウェルニッケ脳症|b.ビタミンB12欠乏 — 悪性貧血（巨赤芽球性貧血）|c.ビタミンC欠乏 — 夜盲症|d.ビタミンK欠乏 — くる病|e.葉酸欠乏 — 出血傾向,a&b,B1欠乏は脚気やウェルニッケ脳症、B12および葉酸欠乏は巨赤芽球性貧血（悪性貧血）の原因となります。C欠乏は壊血病、A欠乏は夜盲症、D欠乏はくる病、K欠乏は出血傾向です。
食道の生理機能について正しい記述はどれか。2つ選べ。,基礎,a.上部食道括約筋（UES）は嚥下時に弛緩する|b.下部食道括約筋（LES）は胃食道逆流を防いでいる|c.食道蠕動は逆蠕動が基本である|d.食道粘膜は吸収上皮である|e.気管の前方に位置する,a&b,嚥下時にUESが弛緩して食物を受け入れ、LESは通常収縮しており胃酸逆流を防ぎ、嚥下時のみ弛緩します。食道は気管の後方です。
ヘリコバクター・ピロリ感染に関連する疾患はどれか。2つ選べ。,臨床,a.胃MALTリンパ腫|b.特発性血小板減少性紫斑病（ITP）|c.クローン病|d.潰瘍性大腸炎|e.食道アカラシア,a&b,ピロリ菌は胃炎、胃潰瘍、胃癌、MALTリンパ腫のほか、胃外疾患としてITP（特発性血小板減少性紫斑病）との関連が認められており、除菌療法が有効です。
炎症性腸疾患（IBD）の鑑別点として正しい記述はどれか。2つ選べ。,臨床,a.潰瘍性大腸炎は直腸から連続性に病変が広がる|b.クローン病は縦走潰瘍や敷石像が特徴である|c.潰瘍性大腸炎は全層性の炎症をきたす|d.クローン病は血管透見像の消失が特徴的である|e.両者とも感染性腸炎である,a&b,UCは連続性・粘膜層主体の炎症、CDは非連続性・全層性の炎症で縦走潰瘍や敷石像を呈します。
胃ポリープについて正しい記述はどれか。2つ選べ。,臨床,a.胃底腺ポリープはピロリ菌陰性の胃に多い|b.過形成性ポリープは発赤調でピロリ菌感染胃に多い|c.胃底腺ポリープは癌化率が高い|d.過形成性ポリープは自然消失することはない|e.家族性大腸腺腫症に伴う胃ポリープは腺腫である,a&b,胃底腺ポリープはピロリ陰性の萎縮のない胃に多発する良性病変。過形成ポリープはピロリ感染（萎縮性胃炎）を背景とし、除菌により縮小・消失することがあります。
早期食道癌の内視鏡診断について正しい記述はどれか。2つ選べ。,臨床,a.ヨード（ルゴール）染色で不染帯として認識される|b.NBI拡大観察で茶褐色の異常血管（IPCL変化）が見られる|c.通常観察で隆起型となることが多い|d.インジゴカルミン散布で青染される|e.生検は禁忌である,a&b,扁平上皮癌はグリコーゲン欠乏によりヨード不染となります。NBIなどの狭帯域光観察では、上皮内血管ループ（IPCL）の形態変化やB1/B2血管などの異常血管を茶褐色に描出します。
大腸憩室の特徴として正しい記述はどれか。2つ選べ。,臨床,a.S状結腸に好発する|b.出血時は腹痛を伴わないことが多い|c.憩室炎では発熱や腹痛を伴う|d.若年者に多い|e.先天性の真性憩室が大部分である,a&c,大腸憩室は内圧の高いS状結腸に多く、炎症（憩室炎）を起こすと疼痛・発熱します。憩室出血は突然の下血をきたしますが、出血そのものによる腹痛は伴わないことが多いです（無痛性大量出血）。
高周波電流（電気メス）の原理について正しい記述はどれか。2つ選べ。,機器,a.切開波は連続した波形で組織を切開する|b.凝固波は断続的な波形で止血効果が高い|c.凝固波は電圧が低い|d.混合波は存在しない|e.ジュール熱ではなく摩擦熱を利用している,a&b,切開波は低電圧・連続波で細胞内液を沸騰させ破裂（切開）させます。凝固波は高電圧・断続波（休止期あり）で組織を脱水・変性（凝固）させます。
超音波内視鏡（EUS）のプローブ方式について正しい記述はどれか。2つ選べ。,機器,a.ラジアル走査式は360度の全周画像が得られる|b.コンベックス（セクタ）走査式は穿刺吸引術（FNA）に適している|c.リニア走査式はスクリーニング専用である|d.超音波周波数が高いほど深部まで観察できる|e.バルーン法では空気を注入する,a&b,ラジアルは位置関係把握に適した全周像、コンベックスは穿刺ラインが見えるためFNAに適します。周波数が高いほど解像度は上がりますが深達度は低下します。バルーンには脱気水を入れます。
カプセル内視鏡（小腸用）の禁忌・注意点について正しい記述はどれか。2つ選べ。,機器,a.消化管の狭窄や閉塞が疑われる場合は原則禁忌である|b.ペースメーカー装着者は機種確認が必要である|c.パテンシーカプセルは本検査の後に使用する|d.大腸癌の診断に優れている|e.生検が可能である,a&b,滞留リスクのある狭窄例は禁忌。パテンシーカプセルは開通性確認のため「事前」に使用します。現在主流のカプセルには生検機能はありません。
NBI（Narrow Band Imaging）の原理について正しい記述はどれか。2つ選べ。,機器,a.415nm（青）と540nm（緑）の狭帯域光を使用する|b.ヘモグロビンの吸光特性を利用している|c.粘膜深部の血管観察に適している|d.赤外線を利用している|e.薬剤を散布して観察する,a&b,血液中のヘモグロビンに吸収されやすい短波長の光（青・緑）を照射し、粘膜表層の血管や微細構造のコントラストを強調します。深部観察には不向きです。
内視鏡の送気・送水システムについて正しい記述はどれか。2つ選べ。,機器,a.送気ポンプから出た空気はボトル内の水を加圧する|b.スコープの送気・送水ボタンを押すと水が出る|c.ボタンの穴を塞ぐと送気される|d.水タンクの水は水道水でよい|e.CO2送気は専用の装置を必要としない,b&c,通常、ボタンの穴を指で塞ぐと送気され、ボタンを深く押し込むと送水されます。タンクの水は滅菌水が推奨され、毎日交換します。
鎮静薬プロポフォールの特徴として正しい記述はどれか。2つ選べ。,薬理,a.作用発現が速く覚醒も速やかである|b.呼吸抑制や血圧低下のリスクがある|c.特異的な拮抗薬（リバース）が存在する|d.鎮痛作用が強い|e.大豆アレルギーは禁忌である,a&b,プロポフォールは半減期が短く調節性に優れますが、呼吸・循環抑制があり、拮抗薬がないため慎重な管理が必要です。製剤に含まれる添加物により大豆・卵アレルギーは禁忌（または慎重投与）です。
オピオイド鎮痛薬（ペチジン等）の使用について正しい記述はどれか。2つ選べ。,薬理,a.鎮痛作用を目的として使用する|b.拮抗薬はナロキソンである|c.呼吸抑制は起こらない|d.制吐作用がある|e.前立腺肥大症には禁忌である,a&b,ペチジンは鎮痛効果があり、副作用として呼吸抑制、悪心・嘔吐があります。拮抗薬はナロキソンです。抗コリン薬と異なり緑内障や前立腺肥大への禁忌はありません。
抗血栓薬の休薬・継続ガイドラインについて正しい記述はどれか。2つ選べ。,薬理,a.アスピリン単剤での粘膜生検は休薬不要である|b.ワルファリン服用者のESDはヘパリン置換等を考慮する|c.DOAC服用者は休薬なしでESDが可能である|d.すべての内視鏡検査で休薬が必要である|e.ポリペクトミーは抗血栓薬継続下で行うのが原則である,a&b,出血低リスク手技（生検等）は単剤なら休薬不要。高リスク手技（ESD/EMR）では、ワルファリンはヘパリン置換、DOACは当日休薬などの対策が必要です。
