question,category,options,answer,explanation
血小板数が低下する疾患はどれか。,臨床,a.本態性血小板血症|b.血小板減少性紫斑病（ITP）|c.播種性血管内凝固症候群（DIC）|d.溶血性尿毒症症候群（HUS）|e.肝硬変,b&c&d&e,ITP、DIC、HUS、肝硬変（脾機能亢進）はいずれも血小板減少をきたす。本態性血小板血症は血小板が増加する。
鎮静鎮痛、鎮痙薬と拮抗薬の組み合わせで誤っているものはどれか。,薬理,a.ミダゾラム --- フルマゼニル|b.ペチジン塩酸塩 --- ナロキソン塩酸塩|c.プロポフォール --- なし|d.デクスメデトミジン塩酸塩 --- フルマゼニル|e.ジアゼパム --- フルマゼニル,d,デクスメデトミジンの拮抗薬はアチパメゾール（※本邦未承認の場合もあるがフルマゼニルではない）。フルマゼニルはベンゾジアゼピン系（ミダゾラム、ジアゼパム）の拮抗薬。
スポルディング分類について正しいのはどれか。,管理,a.低水準消毒は高水準消毒より強力である|b.消化器内視鏡はクリティカルに分類される|c.医療機器や機材の適切な操作方法の分類である|d.ホルマリン・ポビドンヨード・クレゾール石鹸液は中水準消毒薬に分類される|e.非脂質はグルタラールで死滅する,d,スポルディング分類は感染リスクに応じた消毒レベルの分類。内視鏡はセミクリティカル（高水準消毒）。ポビドンヨード等は中水準。グルタラールは高水準。
消化管の壁構造で管腔内から壁外へ向かって正しい順序はどれか。,基礎,a.粘膜—粘膜下層—固有筋層—漿膜下層—漿膜|b.粘膜—粘膜筋板—粘膜下層—固有筋層—漿膜下層—漿膜|c.粘膜—固有筋層—粘膜筋板—粘膜下層—漿膜|d.粘膜—固有筋層—粘膜下層—粘膜筋板—漿膜,b,消化管壁は内側から、粘膜上皮・粘膜固有層・粘膜筋板（これらを合わせて粘膜層）、粘膜下層、固有筋層、漿膜下層、漿膜の順で構成されている。食道など一部は漿膜を欠き外膜となる。
ヘリコバクター・ピロリ感染の診断方法として内視鏡を使用するものはどれか。,臨床,a.迅速ウレアーゼ試験|b.尿素呼気試験|c.抗体法（血液・尿）|d.便中抗原測定,a,迅速ウレアーゼ試験、鏡検法、培養法は内視鏡で胃粘膜を採取（生検）して行う侵襲的検査である。尿素呼気試験や抗体法は内視鏡を用いない非侵襲的検査である。
肝硬変の際にみられる身体所見（表徴）はどれか。,臨床,a.手掌紅斑|b.スプーン状爪|c.眼球突出|d.蝶形紅斑,a,肝硬変ではエストロゲン代謝異常などにより、手掌紅斑やクモ状血管腫、女性化乳房などが見られる。また門脈圧亢進により食道静脈瘤や脾腫（脾機能亢進）を合併する。
クローン病について正しいのはどれか。,臨床,a.直腸から連続性に広がる|b.全層性の炎症により狭窄や瘻孔を形成しやすい|c.血管透見像の消失が特徴である|d.高齢者に好発する,b,クローン病は消化管のあらゆる部位に非連続性（飛び石状）の病変を形成し、全層性炎症のため狭窄、瘻孔、膿瘍などを合併しやすい。連続性病変や血管透見消失は潰瘍性大腸炎の特徴である。
小腸用カプセル内視鏡検査について誤っている記述はどれか。,機器,a.患者の苦痛は少ない|b.小腸の狭窄が疑われる場合は禁忌である|c.カプセルは回収して再利用する|d.検査中は日常生活に近い行動が可能である,c,カプセル内視鏡はディスポーザブル（使い捨て）であり、通常は便とともに排出され廃棄する。狭窄がある場合は滞留（滞留）のリスクがあるため禁忌である。
胃の部位名称において、口側から肛門側への順序で正しいものはどれか。,基礎,a.噴門—胃体部—胃角部—前庭部—幽門|b.噴門—胃角部—胃体部—前庭部—幽門|c.噴門—前庭部—胃体部—胃角部—幽門|d.幽門—前庭部—胃体部—胃角部—噴門,a,食道との接合部が噴門、その下が胃体部、小弯の切痕部が胃角部、その先が幽門前庭部、十二指腸への出口が幽門である。
副交感神経遮断薬（抗コリン薬）によって起きない反応はどれか。,薬理,a.瞳孔散大（散瞳）|b.頻脈|c.消化管運動の抑制|d.瞳孔縮小（縮瞳）,d,抗コリン薬（ブチルスコポラミン等）は副交感神経を抑制するため、交感神経優位となり散瞳、心拍数増加（頻脈）、消化管運動抑制、口渇などが起こる。縮瞳は起きない。
ワルファリンカリウムが拮抗するビタミンはどれか。,薬理,a.ビタミンA|b.ビタミンB1|c.ビタミンC|d.ビタミンK,d,ワルファリンは肝臓でのビタミンK依存性凝固因子の合成を阻害することで抗凝固作用を発揮する。したがってビタミンK（納豆やクロレラ等）の摂取により作用が減弱する。
食欲を亢進（増進）させるホルモンはどれか。,基礎,a.レプチン|b.グルカゴン|c.グレリン|d.セクレチン,c,グレリンは胃から分泌され、食欲を亢進させる作用を持つ。レプチンは脂肪細胞から分泌され食欲を抑制する。
消化管粘膜下腫瘍（SMT）の精査として最も有用な検査はどれか。,臨床,a.NBI拡大観察|b.超音波内視鏡検査（EUS）|c.ルゴール染色|d.インジゴカルミン散布,b,SMTは粘膜の下にある病変であり、表面を見る通常内視鏡やNBIでは内部構造が分からない。EUSを用いることで病変の内部性状、発生層、大きさなどを詳細に評価できる。
クリップ止血法について誤っている記述はどれか。,処置,a.再出血の予防効果が高い|b.磁気共鳴画像（MRI）検査は絶対禁忌である|c.組織の壊死が少ない|d.縫縮としても利用できる,b,かつての鉄製クリップはMRI禁忌だったが、現在主流のチタン製やステンレス製クリップの多くはMRI対応（条件付き可）となっており、「絶対禁忌」という記述は誤りになりつつある（ただし製品確認は必須）。
65歳男性、吐血によるショック状態で搬送された。上部消化管内視鏡検査中に鎮静剤による血圧低下が見られた場合の対応として適切な薬剤はどれか。,薬理,a.アトロピン|b.フルマゼニル（拮抗薬）|c.プロプラノロール|d.ヘパリン,b,ベンゾジアゼピン系鎮静薬による過鎮静や呼吸抑制、血圧低下が見られた場合、拮抗薬であるフルマゼニル（アネキセート）を投与して覚醒を促す。
ビタミンについて正しい記述はどれか。,基礎,a.脂溶性ビタミンはB群とCである|b.水溶性ビタミンはA、D、E、Kである|c.体内で合成できないため食事から摂取する必要がある|d.すべて体内で合成できる,c,ビタミンは微量栄養素であり、原則として体内で合成できないため食事摂取が必要。脂溶性はD、A、K、E（だけ）、水溶性はB群、Cである。
高周波電流（電気メス）について正しい記述はどれか。,機器,a.エンドカットモードは組織の切開を行う|b.アルゴンプラズマ凝固（APC）は組織深部まで深く凝固する|c.凝固波は電圧が低く連続波である|d.対極板はバイポーラで必要である,a,エンドカットは切開と凝固を繰り返すモード。APCは浅い凝固が特徴。凝固波は高電圧・断続波。対極板はモノポーラで必要。
リドカイン（キシロカイン）スプレーの使用について誤っている記述はどれか。,薬理,a.1回の噴霧量は製品によって異なる|b.副作用にショックや中毒がある|c.高齢者では増量して使用する|d.血中濃度が上昇すると痙攣などを起こす,c,高齢者や肝機能障害患者では代謝が遅延し中毒を起こしやすいため、減量して慎重に使用する必要がある。
カルテ記載で用いられる略語と意味の組み合わせで正しいのはどれか。,管理,a.NSAIDs — 非ステロイド性抗炎症薬|b.PPI — プロトンポンプ阻害薬|c.ESD — 内視鏡的粘膜下層剥離術|d.すべての組み合わせ,d,NSAIDs（Non-Steroidal Anti-Inflammatory Drugs）、PPI（Proton Pump Inhibitor）、ESD（Endoscopic Submucosal Dissection）はいずれも正しい。
内視鏡の洗浄・消毒管理において不要な項目はどれか。,管理,a.洗浄履歴の記録|b.消毒薬の濃度管理|c.洗浄室のCO2濃度測定|d.水質管理（細菌検査等）,c,洗浄・消毒工程において、CO2濃度の測定は不要である。グルタラール等の蒸気濃度管理（環境対策）は必要だが、CO2ではない。
消化管出血の止血に使用される薬剤として正しいものはどれか。,薬理,a.トロンビン|b.高張Naエピネフリン液（HSE）|c.エタノール|d.すべての薬剤,d,トロンビンは散布して凝固を促進、HSEは局注して血管収縮と膨隆による圧迫、エタノールは局注して組織固定・脱水凝固による止血を行う。
早期食道癌（扁平上皮癌）の内視鏡診断に有用な色素はどれか。,臨床,a.インジゴカルミン|b.ヨード（ルゴール）|c.クリスタルバイオレット|d.メチレンブルー,b,食道扁平上皮癌はグリコーゲンが乏しいため、ヨード液を散布すると染まらずに不染帯となり、正常粘膜（濃染）と識別できる。
医療英語「Nausea」の意味はどれか。,基礎,a.嘔吐|b.吐き気（悪心）|c.下痢|d.胸やけ,b,Nauseaは吐き気（悪心）。Vomitingは嘔吐、Diarrheaは下痢、Heartburnは胸やけ。
消毒薬の分類において高水準消毒薬に該当するものはどれか。,管理,a.グルタラール|b.ポビドンヨード|c.塩化ベンザルコニウム|d.クロルヘキシジン,a,グルタラール、フタラール、過酢酸は高水準消毒薬。ポビドンヨード、アルコールは中水準。逆性石鹸（ベンザルコニウム）は低〜中水準。
ヘリコバクター・ピロリ除菌療法に用いられる薬剤はどれか。,薬理,a.抗ウイルス薬|b.プロトンポンプ阻害薬（PPI）と抗生物質|c.抗真菌薬|d.ステロイド薬,b,除菌療法には胃酸分泌抑制薬（PPIまたはP-CAB）と、2種類の抗生物質（アモキシシリン、クラリスロマイシン等）の併用療法が行われる。
ERCP（内視鏡的逆行性胆管膵管造影）の偶発症として最も頻度が高いものはどれか。,処置,a.出血|b.穿孔|c.急性膵炎|d.誤嚥性肺炎,c,ERCP後膵炎は最も頻度が高く重篤になりうる偶発症であり、予防策（NSAIDs、輸液等）が重要である。
大腸内視鏡検査の前処置（洗腸剤）について正しい記述はどれか。,管理,a.腸閉塞の疑いがある患者にも全量投与する|b.排泄液が透明になるまで服用する|c.前日は脂肪の多い食事を摂取する|d.脱水を防ぐため水分摂取を制限する,b,腸管内をきれいにするため、排便が透明な水様便になるまで洗腸剤を服用する。腸閉塞疑いでは穿孔リスクがあるため禁忌。
超音波内視鏡（EUS）の走査方式において、穿刺吸引術（FNA）に適しているのはどれか。,機器,a.ラジアル走査式|b.コンベックス（セクタ）走査式|c.リニア走査式（体表用）|d.Aモード,b,コンベックス走査式は超音波断層面と穿刺針の走行が同一平面上にあるため、針先をリアルタイムで確認しながら穿刺できる。ラジアルは360度観察用。
十二指腸乳頭が開口している部位はどれか。,基礎,a.十二指腸球部|b.十二指腸下行部|c.十二指腸水平部|d.空腸上部,b,主膵管と総胆管が合流する大十二指腸乳頭（ファーター乳頭）は、十二指腸下行部の内側に開口している。
内視鏡的乳頭括約筋切開術（EST）で使用する処置具はどれか。,処置,a.スネア鉗子|b.パピロトーム（弓状ナイフ）|c.ホットバイオプシー鉗子|d.バスケット鉗子,b,ESTはパピロトームを用いて乳頭を切開する。スネアはポリープ切除、バスケットは結石除去に用いる。
食道静脈瘤硬化療法（EIS）の禁忌となる病態はどれか。,処置,a.重篤な腎障害|b.高度な肝性脳症や黄疸|c.貧血|d.胃潰瘍の合併,b,重篤な肝障害（肝性脳症、黄疸、難治性腹水など）がある場合、硬化剤による肝障害の悪化や全身状態悪化のリスクがあるため禁忌となる。
内視鏡的粘膜下層剥離術（ESD）中の偶発症である穿孔に対する処置として適切なものはどれか。,処置,a.クリップによる縫縮閉鎖|b.直ちに開腹手術|c.スネアによる結紮|d.放置して経過観察,a,術中穿孔に対しては、内視鏡的にクリップを用いて穿孔部を閉鎖し、保存的治療（絶食・補液・抗生剤）を行うのが第一選択である。
経皮内視鏡的胃瘻造設術（PEG）の禁忌となる状態はどれか。,処置,a.脳卒中による嚥下障害|b.認知症による摂食困難|c.大量の腹水貯留|d.頭頸部癌による通過障害,c,大量の腹水がある場合、胃壁と腹壁を密着させることができず、腹腔内への漏出や腹膜炎のリスクが高いため禁忌である。
内視鏡スコープの操作部にあるボタン機能で、一般的に正しい組み合わせはどれか。,機器,a.青ボタン—送気・送水、赤ボタン—吸引|b.青ボタン—吸引、赤ボタン—送気・送水|c.青ボタン—写真、赤ボタン—ズーム|d.ボタン機能は固定されており変更できない,a,オリンパス製などの一般的なスコープでは、青色ボタンが送気・送水、赤色ボタンが吸引に割り当てられていることが多い。
NBI（狭帯域光観察）が診断に有用な病変の特徴はどれか。,臨床,a.粘膜下層の深部血管|b.粘膜表層の微細血管や表面構造|c.胆管結石|d.脂肪組織,b,NBIはヘモグロビンに吸収されやすい青・緑の狭帯域光を用いることで、粘膜表層の毛細血管や微細模様（Pitなど）を強調し、癌の早期発見や質的診断に有用である。
胆石の種類で最も頻度が高いものはどれか。,臨床,a.黒色石|b.ビリルビンカルシウム石|c.コレステロール石|d.脂肪酸カルシウム石,c,食生活の欧米化に伴い、現在はコレステロール結石が胆石症の中で最も高い割合を占めている。
消化管の壁構造について正しい記述はどれか。2つ選べ。,a.食道壁には漿膜がない|b.胃の固有筋層は内輪・外縦の2層構造である|c.アウエルバッハ神経叢は粘膜下層に存在する|d.粘膜筋板は粘膜層と粘膜下層の境界にある|e.小腸の粘膜上皮は重層扁平上皮である,a&d,食道は外膜に覆われており漿膜を欠きます。粘膜筋板は粘膜固有層の下にあり粘膜下層との境界をなします。胃の筋層は3層（内斜・中輪・外縦）、神経叢は筋層間（アウエルバッハ）と粘膜下層（マイスネル）、小腸上皮は単層円柱上皮です。
膵臓および関連ホルモンについて正しい記述はどれか。2つ選べ。,a.ランゲルハンス島A細胞（α細胞）はグルカゴンを分泌する|b.ランゲルハンス島B細胞（β細胞）はソマトスタチンを分泌する|c.インスリンは血糖値を低下させる|d.グルカゴンはグリコーゲン合成を促進する|e.膵液は酸性の消化液である,a&c,A細胞はグルカゴン（血糖上昇）、B細胞はインスリン（血糖低下）を分泌します。D細胞がソマトスタチンを分泌します。膵液は重炭酸イオンを含むアルカリ性です。
消化吸収と栄養素の輸送について正しい記述はどれか。2つ選べ。,a.タンパク質はアミノ酸に分解されて吸収される|b.脂肪酸（長鎖）はリンパ管（胸管）を経て静脈へ入る|c.ブドウ糖はリンパ管を通って輸送される|d.ビタミンB12は胃で吸収される|e.胆汁酸は十二指腸で吸収される,a&b,タンパク質はアミノ酸に、炭水化物は単糖類（ブドウ糖等）に分解され門脈へ入ります。脂肪はカイロミクロンとなりリンパ管（胸管）に入ります。B12と胆汁酸は回腸末端で吸収されます。
胃癌のリスクファクターや病態について正しい記述はどれか。2つ選べ。,a.ヘリコバクター・ピロリ感染は主要な原因である|b.食塩の過剰摂取はリスク因子である|c.早期胃癌の定義は腫瘍径2cm以下である|d.印環細胞癌は分化型腺癌に分類される|e.未分化型癌は高齢男性に多い,a&b,ピロリ菌感染と高塩分食は胃癌の確実なリスク因子です。早期胃癌は深達度（SMまで）で定義されます。印環細胞癌は未分化型で、若年女性にも見られます。
潰瘍性大腸炎（UC）の特徴について正しい記述はどれか。2つ選べ。,a.直腸から連続性に口側へ広がる|b.粘膜全層に炎症が及ぶ|c.血管透見像の消失やびらんが見られる|d.敷石像や縦走潰瘍が特徴的である|e.瘻孔や狭窄を形成しやすい,a&c,UCは直腸から始まる連続性のびまん性炎症で、粘膜・粘膜下層にとどまるため血管透見が消失します。全層性炎症、敷石像、瘻孔はクローン病の特徴です。
食道アカラシアについて正しい記述はどれか。2つ選べ。,a.下部食道括約筋（LES）の弛緩不全が原因である|b.嚥下障害や胸痛をきたす|c.食道癌の合併リスクは低い|d.治療の第一選択は胃全摘術である|e.高齢者にのみ発症する,a&b,アカラシアはLESが弛緩せず食道拡張をきたす疾患で、嚥下困難が主訴です。食道癌リスクは健常者より高いです。治療はバルーン拡張やPOEM（筋層切開）であり、胃全摘はしません。
肝硬変に伴う門脈圧亢進症の所見として正しいものはどれか。2つ選べ。,a.食道・胃静脈瘤|b.脾腫（脾機能亢進症）|c.左心不全|d.胆嚢収縮不全|e.十二指腸潰瘍,a&b,門脈圧亢進により側副血行路（静脈瘤）が形成され、脾臓がうっ血して腫大（血小板減少）します。
内視鏡の洗浄・消毒に使用される薬剤の特徴について正しい記述はどれか。2つ選べ。,a.酵素洗剤はタンパク質や脂質の分解に有効である|b.グルタラールは金属腐食性が非常に強い|c.過酢酸はタンパク凝固作用がない|d.アルコールは高水準消毒薬に分類される|e.フタラールは芽胞に対して数秒で有効である,a&c,酵素洗剤は有機物除去に必須です。過酢酸は凝固作用がなく低温で使用可能です。グルタラールは腐食性は比較的低いです。アルコールは中水準、フタラールは芽胞への効力は遅いです。
スポルディングの分類と内視鏡器具の取り扱いについて正しい記述はどれか。2つ選べ。,a.生検鉗子はクリティカル器具であり滅菌が必要である|b.内視鏡スコープはセミクリティカル器具であり高水準消毒が必要である|c.マウスピースはノンクリティカル器具であり洗浄のみでよい|d.処置具の再利用（リユース）は推奨されている|e.高水準消毒には塩化ベンザルコニウムを用いる,a&b,粘膜を穿刺する鉗子は滅菌（クリティカル）、粘膜に触れるスコープは高水準消毒（セミクリティカル）です。マウスピースも粘膜に触れるため高水準消毒が望ましいです。ベンザルコニウムは低水準です。
鎮静薬および拮抗薬の組み合わせで正しいものはどれか。2つ選べ。,a.ミダゾラム — フルマゼニル|b.ペチジン — ナロキソン|c.プロポフォール — アチパメゾール|d.ジアゼパム — ナロキソン|e.デクスメデトミジン — フルマゼニル,a&b,ベンゾジアゼピン系（ミダゾラム等）の拮抗薬はフルマゼニル、オピオイド（ペチジン等）の拮抗薬はナロキソンです。プロポフォールに拮抗薬はありません。
抗血栓薬服用者の内視鏡検査（生検）についてガイドライン上正しい記述はどれか。2つ選べ。,a.アスピリン単剤服用者は休薬なしで生検可能である|b.ワルファリン服用者はPT-INRが治療域内であれば生検可能である|c.DOAC（直接作用型抗凝固薬）服用者は当日の朝のみ休薬して生検する|d.すべての抗血栓薬は5日間休薬しなければならない|e.ヘパリン置換を行わないと生検できない,a&b,生検は出血低リスク手技であり、アスピリン単剤やワルファリン（INR治療域内）単剤であれば休薬不要とされています。DOACは半減期が短いため当日休薬等の対応がとられますが、一律5日休薬は誤りです。
内視鏡的電気手術（高周波治療）において正しい記述はどれか。2つ選べ。,a.モノポーラ方式では対極板の装着が必須である|b.凝固波は断続的な波形で止血効果が高い|c.切開波は電圧が低く組織深部まで凝固する|d.バイポーラ方式は電流が全身を流れる|e.スネアの通電時間は長いほど安全である,a&b,モノポーラは対極板へ電流を回収します。凝固波は断続波（休止期あり）でジュール熱による凝固・止血を行います。切開波は連続波です。
アルゴンプラズマ凝固法（APC）の特徴として正しい記述はどれか。2つ選べ。,a.非接触で通電・凝固が可能である|b.組織への深達度が浅く穿孔リスクが低い|c.対極板は不要である|d.大きなポリープの切除に適している|e.水中（血液中）でも放電できる,a&b,APCはイオン化ガスを用いた非接触凝固で、均一かつ浅い凝固層を形成します。モノポーラなので対極板は必要です。液体中では放電しません。
早期胃癌に対する内視鏡的粘膜下層剥離術（ESD）の適応（絶対適応・拡大適応）に含まれるものはどれか。2つ選べ。,a.2cmを超える潰瘍のない分化型粘膜内癌|b.3cm未満の潰瘍のある分化型粘膜内癌|c.リンパ節転移が明らかな病変|d.他臓器への転移がある病変|e.粘膜下層深部（SM2）へ浸潤した病変,a&b,リンパ節転移のリスクがないことが前提で、サイズや潰瘍の有無により適応が決まります。UL(-)ならサイズ制限なし、UL(+)なら3cm以下などが適応です。SM2以深は外科手術適応です。
内視鏡的逆行性胆管膵管造影（ERCP）の偶発症予防について正しい記述はどれか。2つ選べ。,a.ERCP後膵炎予防にNSAIDs（ジクロフェナク）坐剤が有効である|b.十分な輸液負荷が膵炎予防に推奨される|c.予防的抗菌薬投与は推奨されない|d.検査直後から食事を開始する|e.アミラーゼ値の上昇がなければ膵炎は否定できる,a&b,ガイドラインではNSAIDsの直腸投与と十分な輸液がERCP後膵炎の発症を有意に抑制するとされています。
消化管間質腫瘍（GIST）について正しい記述はどれか。2つ選べ。,a.カハール介在細胞由来の腫瘍である|b.粘膜下腫瘍（SMT）の形態をとる|c.上皮性の悪性腫瘍（癌）である|d.リンパ節転移を頻繁にきたす|e.ヘリコバクター・ピロリ除菌が第一選択である,a&b,GISTは消化管運動のペースメーカー細胞（カハール細胞）由来の間葉系腫瘍で、SMTとして発育します。治療は切除または分子標的薬です。
ビタミン欠乏症について正しい組み合わせはどれか。2つ選べ。,a.ビタミンB1 — ウェルニッケ脳症|b.ビタミンB12 — 悪性貧血|c.ビタミンC — 夜盲症|d.ビタミンD — 出血傾向|e.ビタミンK — くる病,a&b,B1欠乏は脚気・ウェルニッケ脳症、B12欠乏は巨赤芽球性貧血（悪性貧血）。C欠乏は壊血病、A欠乏は夜盲症、D欠乏はくる病/骨軟化症、K欠乏は出血傾向です。
食道静脈瘤の「赤色所見（Red Color sign）」に分類される所見はどれか。2つ選べ。,a.ミミズ腫れ様発赤（Red wale marking）|b.血豆様発赤（Cherry red spot）|c.白色調（Cw）|d.青色調（Cb）|e.連珠状（F2）,a&b,RCサインは出血リスクを示す所見で、ミミズ腫れ様（Rw）、血豆様（CRS）、赤色血栓（RTh）などがあります。色調（Cw, Cb）や形態（F1-F3）は基本分類です。
