question,category,options,answer,explanation
食道アカラシアについて正しいものはどれか。,臨床,a.ヘリコバクター・ピロリ菌感染との関連が強い|b.食道造影検査で拡張型と紡錘型を分類する|c.食道バルーン拡張の適応である|d.食道内圧検査が有用である|e.下部食道括約筋圧の低下が原因である,c,食道アカラシアの治療には薬物療法、内視鏡的バルーン拡張術、POEM（経口内視鏡的筋層切開術）、外科手術がある。病態は下部食道括約筋（LES）の弛緩不全（圧の上昇）であり、ピロリ菌との関連はない。
胃癌について間違いはどれか。,臨床,a.フソバクテリウムと関連がある|b.萎縮性胃炎と関連がある|c.男性より女性に多い|d.早期胃癌の診断には色素散布が有用である|e.早期胃癌の診断にヨード染色が有用である,e,ヨード染色は食道（扁平上皮）の病変診断に用いられる。胃癌はピロリ菌感染による萎縮性胃炎との関連が強く、男性に多い。フソバクテリウムは大腸癌との関連が示唆されているが、口腔内常在菌であり消化器癌全体での関連も研究されている。
75歳の男性。心筋梗塞後でバイアスピリンとワーファリン内服中。総胆管結石胆管炎で緊急内視鏡的胆道ドレナージ術を施行する。準備する必要がないものはどれか。,処置,a.内視鏡的経鼻胆管ドレナージチューブあるいは胆管ステント|b.パピロトームと高周波装置|c.点滴|d.造影用カテーテル|e.鎮静薬,b,胆管炎に対する第一選択は内視鏡的胆道ドレナージである。パピロトーム（EST用ナイフ）はEST（内視鏡的乳頭括約筋切開術）を行うための器具だが、抗血栓薬2剤内服中のため出血リスクが高く、ESTは避けてドレナージチューブ留置のみを行うべきである。
ERCP後膵炎に対して内視鏡的硬化療法が禁忌なのはどれか。,処置,a.肝性脳症IV度|b.T-Bil 2.0mg/dl|c.血小板 5万/μl|d.血清アルブミン 3.0g/dl|e.（１）、（２）,a,（解説文脈より食道静脈瘤硬化療法EISの禁忌を問う問題の可能性が高いが、ソースの設問に従う）重篤な肝障害（肝性脳症、黄疸、腹水等）やDICなどは硬化療法の禁忌となる。
下記のなかで最も口側に存在するのはどれか。,基礎,a.Cecum|b.Duodenum|c.Ileum|d.Jejunum|e.Rectum,b,a:盲腸、b:十二指腸、c:回腸、d:空腸、e:直腸。解剖学的に口側に最も近いのは十二指腸である。
内視鏡の洗浄・消毒について正しいのはどれか。,管理,a.内視鏡洗浄・消毒の前に感染を調べておく|b.使用後の内視鏡は、すでに内視鏡シンクに持っていければベッドサイド洗浄の必要はない|c.グルタラール製剤は濃度が保たれていればいつまでも使用可能である|d.内視鏡洗浄機の消毒は、感染源なので消毒をおこなくてよい|e.強酸性水は内視鏡の消毒として使用されている,e,使用後の内視鏡は、乾燥を防ぐため直ちにベッドサイドで酵素洗剤吸引・送気送水を行う（プレクリーニング）。グルタラールには使用期限がある。強酸性水は一部で使用されているが認可された高水準消毒薬の使用が推奨される。
内視鏡的進行性胆管審査造影法関連手技において避けるべき手技と、その偶発症の組み合わせについて、誤っているものはどれか。,処置,a.黒色便……内視鏡的乳頭括約筋切開術（出血）|b.発熱……胆管造影（胆管炎）|c.高熱……胆管炎|d.背部痛……内視鏡的乳頭括約筋切開術（穿孔）|e.黄疸……内視鏡的乳頭部切除,e,内視鏡的乳頭切除術（パピレクトミー）などにより胆管出口が狭窄・閉塞すれば黄疸をきたすが、「避けるべき手技」という文脈では偶発症との対応を問うている。出血なら黒色便、穿孔なら背部痛、胆管炎なら発熱・黄疸などが生じる。
消化管について誤りはどれか。,基礎,a.胃体部の筋層は外縦・中輪・内斜筋の3層からなる|b.胃は穹窿部・胃体部・胃角部・前庭部の順で並んでいる|c.小腸は十二指腸・空腸・回腸からなり、6～7mの長さがある|d.S状結腸は後腹膜腔に存在する|e.肝弯曲は右腎前面に接する,d,S状結腸は腹膜内器官であり腸間膜を有する。後腹膜腔に存在するのは十二指腸（球部除く）、上行結腸、下行結腸、直腸の一部である。
膵臓のランゲルハンス島から分泌されるホルモンで正しいのはどれか。,基礎,a.インスリン|b.グルカゴン|c.ソマトスタチン|d.アドレナリン|e.コレシストキニン,a,膵臓のランゲルハンス島からは、A細胞（グルカゴン）、B細胞（インスリン）、D細胞（ソマトスタチン）などが分泌される。アドレナリンは副腎髄質、コレシストキニンは小腸から分泌される。
腫瘍マーカーについて正しいものはどれか。,臨床,a.NSEは神経内分泌細胞由来の腫瘍で大量に産生される|b.SCCは腺癌の腫瘍マーカーとして用いる|c.CEAは早期癌の発見に有用である|d.CA19-9は膵癌特異性が高い|e.DUPAN-2は消化器癌、特に膵癌・胆道癌に対して鋭敏である,a&e,SCCは扁平上皮癌のマーカー。CEAは腺癌のマーカーだが早期発見には不向き。CA19-9は膵癌・胆道癌で上昇するが特異性はそれほど高くない。NSEは小細胞癌や神経内分泌腫瘍で上昇する。
抗血栓薬服用中の消化器内視鏡検査において基礎疾患について問診で確認が必要である。誤っている対応はどれか。,薬理,a.バイアスピリン内服中に生検は可能である|b.ワルファリンカリウムは3～4日間、アスピリンは3日間、チクロピジン塩酸塩は5日間の休薬がなされていることを確認して生検する|c.アスピリン、アスピリン以外の抗血小板薬、抗凝固薬のいずれか1剤を服用している場合は、休薬なしで生検してよい|d.クロピドグレル硫酸塩内服中に生検・出血なしを確認する,b,ガイドラインでは、アスピリンなどの抗血小板薬単剤、あるいはワルファリンなどの抗凝固薬単剤であれば、休薬なしで生検を行うことが許容されている（出血リスクは低いとされる）。休薬期間を設けるという記述は古いか誤り。
血液検査で貧血が見られた。貧血の原因となる疾患はどれか。,臨床,a.本態性血小板血症|b.血小板減少性紫斑病|c.肝硬変症|d.播種性血管内凝固症候群|e.溶血性尿毒症症候群,c,肝硬変では門脈圧亢進による脾機能亢進症で血小板減少や貧血（消化管出血含む）をきたす。
次の組み合わせのうち誤っているものはどれか。,臨床,a.acute cholecystitis - 急性胆嚢炎|b.pancreatic cancer - 膵臓癌|c.gallbladder polyp - 胆嚢ポリープ|d.primary biliary cholangitis - 原発性胆汁性肝硬変（PBC）|e.primary sclerosing cholangitis - 原発性硬化性胆管炎（PSC）,d,Primary Biliary Cholangitisの日本語訳は現在「原発性胆汁性胆管炎」に変更されている（以前は肝硬変と言われていた）。
鎮静に用いるベンゾジアゼピン系薬物の拮抗薬として正しいものはどれか。,薬理,a.ミダゾラム|b.ペンタゾシン塩酸塩|c.プロポフォール|d.フルマゼニル|e.ジアゼパム,d,ベンゾジアゼピン系（ミダゾラム等）の拮抗薬はフルマゼニル（アネキセート）である。ナロキソンはオピオイド拮抗薬。
接触感染対策（手指衛生、ガウン、手袋）が必要な病原体はどれか。,管理,a.結核菌|b.インフルエンザウイルス|c.麻疹ウイルス|d.多剤耐性緑膿菌|e.風疹ウイルス,d,多剤耐性菌やクロストリディオイデス・ディフィシル、ノロウイルスなどは接触感染対策が必要。結核・麻疹は空気感染、インフルエンザ・風疹は飛沫感染対策が主となる。
医療面接（インフォームド・コンセント）について正しいのはどれか。,管理,a.患者の自己決定権を尊重する|b.専門用語を多用して説明する|c.家族の同意があれば本人の同意は不要|d.看護師が主体となって行う|e.一度同意したら撤回できない,a,患者が十分に理解できるよう平易な言葉で説明し、患者自身の自由な意思決定（自己決定権）を支援・尊重するのが基本である。
早期胃癌の深達度診断で正しいのはどれか。,臨床,a.粘膜内癌は通常200倍程度の拡大観察で識別可能である|b.カプセル内視鏡は食道から小腸までの拡大内視鏡観察が可能である|c.電子内視鏡はCCDカメラからグラスファイバーを束ねて画像が伝送される|d.細径内視鏡は送気・送水チャンネルから挿入する|e.通常の拡大内視鏡は最大で約135倍（32インチモニター上）の高解像度拡大画像を得ることができる,e,最新の拡大内視鏡は光学ズームにより高倍率（80〜100倍以上）の観察が可能。カプセル内視鏡は拡大機能を持たない（一部を除く）。
小児内視鏡について正しいものはどれか。,管理,a.内視鏡的逆行性胆管膵管造影法（ERCP）は禁忌である|b.鎮静の内服薬を使用する|c.成人と比較して先天性疾患の割合が多い|d.家族への十分なインフォームドコンセントが重要である|e.全身麻酔の使用は禁忌である,c&d,小児では先天性胆道拡張症などの先天性疾患に対しERCPを行うことがあるため禁忌ではない。鎮静や全身麻酔は必要に応じて行われる。家族（保護者）へのICが必須。
内視鏡的粘膜切除術（EMR）について正しいものはどれか。,処置,a.生理食塩水あるいはヒアルロン酸ナトリウムなどを粘膜下層に局注する|b.大腸で術中穿孔率は5%程度である|c.スネアで病変を絞扼し高周波電源を用いて切除する|d.Non-lifting signを呈する粘膜内病変や潰瘍形成病変では手技が困難である|e.すべて,a&c&d,EMRは粘膜下層に生理食塩水等を注入して病変を浮き上がらせ、スネアで絞扼・通電切除する。Non-lifting sign（挙上しない）は深部浸潤や線維化を示唆しEMR困難・禁忌となる。
ERCPに関連する偶発症として、最も多いのが急性膵炎で、他に出血、穿孔、急性胆管炎などがある。誤っているものはどれか。,処置,a.高熱は誤嚥性肺炎の症状である|b.発熱は胆管炎の症状である|c.背部痛は内視鏡的乳頭括約筋切開術後穿孔の症状である|d.腹痛・圧痛、X線撮影にて右腎周囲などの腹腔内にfree airが確認できる|e.黄疸は内視鏡的胆道ドレナージ後の閉塞症状である,a,高熱は胆管炎でも生じる。誤嚥性肺炎でも発熱するが、ERCP偶発症としての高熱＝胆管炎が最も典型的。選択肢の中で明らかに誤り（または他より可能性が低い）を選ぶなら文脈によるが、ここでは解説に基づき判断する。
腹腔鏡・内視鏡合同手術（LECS）について正しいものはどれか。,処置,a.腹腔鏡と内視鏡を併用して胃を部分切除する|b.5cm以下の胃粘膜下腫瘍が適応である|c.内視鏡医による胃内からのアプローチと外科医による腹腔鏡下手術のハイブリッド手術であり全身麻酔下で行う|d.過剰な切除を避けるために考案された手術方法である|e.すべて,e,LECS（Laparoscopic and Endoscopic Cooperative Surgery）は、内視鏡と腹腔鏡を併用し、必要最小限の切除で胃の機能を温存する術式で、主にGISTなどの粘膜下腫瘍に対し行われる。
消化管出血の止血に使用するものはどれか。,処置,a.把持鉗子|b.トロンビン|c.クリップ|d.グリセオール|e.すべて,e,物理的止血（クリップ）、薬剤散布（トロンビン）、薬剤局注（グリセオール等の硬化剤）、把持鉗子（異物除去等や圧迫）などが状況に応じて使用される。
超音波内視鏡下穿刺吸引法（EUS-FNA）に使用する処置具はどれか。,処置,a.パピロトーム|b.スネア|c.穿刺針（FNAニードル）|d.バルーン|e.バスケット鉗子,c,EUS-FNAは超音波ガイド下に穿刺針を用いて組織・細胞を採取する手技である。パピロトームはEST、スネアはポリープ切除に用いる。
60代男性。アルコール性肝硬変で加療中。突然吐血を繰り返して緊急搬送された。救急隊からの情報では、意識消失で全身状態は落ち着いていること、緊急上部消化管内視鏡検査を施行する可能性が高い。内視鏡室しておく必要のないものはどれか。,臨床,a.内視鏡的結紮デバイス（EVL）|b.モニター|c.オーバーチューブ|d.経口腸管洗浄剤|e.二酸化炭素送気装置,d,吐血（食道静脈瘤破裂疑い）の緊急内視鏡において、腸管洗浄剤（下剤）は不要かつ誤嚥のリスクがあり禁忌に近い。止血デバイスや気道確保具、CO2送気は準備すべき。
胆道・膵臓について誤っているものはどれか。,基礎,a.Vater乳頭は十二指腸下行部に存在する|b.総胆管の太さは、正常では直径10-15mmである|c.総肝管と胆嚢管が合流して総胆管となる|d.胆嚢は肝臓の下面に付着している|e.膵臓は、上腸間膜静脈の左側までを膵頭部という,b,総胆管の正常径は7mm前後（〜10mm未満）であり、10-15mmは拡張とみなされる。Vater乳頭は下行部、膵頭部は上腸間膜静脈の右側である。
胆嚢の収縮に関わるホルモンはどれか。,基礎,a.コレシストキニン・パンクレオザイミン（CCK-PZ）|b.インスリン|c.グルカゴン|d.エストロゲン|e.ガストリン,a,CCK（コレシストキニン）は十二指腸・空腸のI細胞から分泌され、胆嚢収縮と膵酵素分泌を促進する。
胃底腺を構成する細胞と分泌物の組み合わせで正しいものはどれか。,基礎,a.主細胞……ペプシノーゲン|b.壁細胞……粘液|c.壁細胞……リパーゼ|d.副細胞……塩酸|e.G細胞……ガストリン,a,主細胞はペプシノーゲン、壁細胞は塩酸（胃酸）と内因子、副細胞は粘液、G細胞はガストリンを分泌する。
膵癌のリスクファクターとして正しいものはどれか。,臨床,a.膵癌の家族歴|b.糖尿病|c.慢性膵炎|d.喫煙、大量飲酒|e.すべて,e,膵癌診療ガイドラインにおいて、家族歴、糖尿病、慢性膵炎、喫煙、肥満などは膵癌のリスクファクターとして挙げられている。
鎮静剤に関する記述のもので正しいものはどれか。,薬理,a.ミダゾラムで呼吸抑制は起こらない|b.ミダゾラムの拮抗薬としてフルマゼニルが使用される|c.デクスメデトミジン塩酸塩に拮抗する薬剤としてアチパメゾールがある|d.プロポフォールは拮抗する薬剤としてフルマゼニルが使用される|e.すべての鎮静薬に拮抗薬がある,b,ミダゾラム（ベンゾジアゼピン系）の拮抗薬はフルマゼニルである。プロポフォールには拮抗薬がない。ミダゾラムは呼吸抑制のリスクがある。
小腸用カプセル内視鏡検査について誤りはどれか。,機器,a.患者の苦痛は蠕動運動シングルユースである|b.小腸開通性が不明であり行うことはできない|c.検査中安静の必要はない|d.パテンシーカプセルを使用する|e.カプセルは回収して再利用する,e,カプセル内視鏡はディスポーザブル（使い捨て）であり、再利用はしない。パテンシーカプセルで開通性を確認後に施行する。
食道アカラシアの診断・検査について正しいものはどれか。,臨床,a.食道内圧検査|b.経鼻食道内視鏡検査|c.上部消化管内視鏡検査|d.食道造影検査|e.すべて,e,アカラシアの診断には、食道造影（鳥の嘴像）、内視鏡（拡張・液体貯留）、食道内圧検査（LES弛緩不全の証明）などが用いられる。
胃潰瘍の分類には、「山田分類」が用いられる。,臨床,a.正しい|b.誤り（崎田・三輪分類）|c.誤り（F分類）|d.誤り（Borrmann分類）|e.誤り（Child-Pugh分類）,b,胃潰瘍の病期分類には「崎田・三輪分類（A、H、S期）」が用いられる。山田分類は胃ポリープ、Borrmann分類は進行胃癌の分類である。
色素内視鏡検査について正しい記述はどれか。,臨床,a.カルジオブルーで食道癌が染色される|b.インジゴカルミンで腺上皮が黒色に染色される|c.酢酸の散布によって腺窩開口部が明瞭化される|d.胃壁にコンゴーレッドを散布すると、胃酸の分泌がある部位が赤く染まる|e.拡大観察の際には色素散布は不要である,c,インジゴカルミンはコントラスト法（溜まり）であり染まらない。コンゴーレッドは胃酸と反応して黒変する。酢酸は粘膜の蛋白を変性させ表面構造（ピット）を明瞭化する（AIM）。
食道について正しい記述はどれか。,基礎,a.食道は気管の前方に位置する|b.食道には漿膜が存在する|c.食道下部は腹膜に覆われている|d.食道内腔は単層円柱上皮で覆われている|e.成人での全長は約25cmである,e,食道は気管の後方に位置し、漿膜を欠く（外膜のみ）。食道粘膜は重層扁平上皮である。全長は約25cm。
内視鏡的逆行性胆管膵管造影検査（ERCP）の危険因子として正しいものはどれか。,処置,a.膵原性腹水|b.女性|c.プレカット|d.Oddi筋機能不全|e.肥満,b&c&d,ERCP後膵炎のリスク因子として、女性、若年者、Oddi筋機能不全、プレカット（手技関連）などが知られている。肥満は直接のリスクではない。
胆管合流異常について誤っているものはどれか。,臨床,a.先天性の疾患である|b.男女比は約1:3で若年女性に多く見られる|c.膵管合流部での胆道拡張の好発年齢は60～70歳である|d.内視鏡的逆行性胆管膵管造影は診断に有用である|e.健常人と比較して胆管結石を合併しやすい,c,先天性胆道拡張症（膵胆管合流異常）は小児期〜若年期に発見されることが多く、好発年齢が60-70歳というのは誤り（胆石等は高齢に多いが先天異常は若年）。胆道癌のリスクが高い。
プレカットはERCP後膵炎の手技的危険因子である。,処置,a.正しい|b.誤り|c.関係ない|d.予防因子である|e.不明,a,プレカット（予備切開）は、通常の挿管困難例に行われる手技であり、膵管への熱侵襲や浮腫を引き起こしやすく、ERCP後膵炎のリスク因子となる。
大腸コールドポリペクトミーについて、正しいものはどれか。,処置,a.抗血小板薬は休薬する必要がある|b.鎮静が必要である|c.ペースメーカーが植え込まれている場合も施行可能である|d.通電が必要である|e.冷凍凝固は必要ない,c&e,Cold Polypectomy（CSP）は高周波通電を行わないため、ペースメーカーへの影響がなく、抗血栓薬服用者でも出血リスクが低いため休薬なしで施行可能な場合が多い。冷凍凝固は行わない。
内視鏡的乳頭括約筋切開術について正しい記述はどれか。,処置,a.偶発症として膵炎がある|b.早期偶発症として総胆管結石再発が挙げられる|c.胆管癌が口側胆管に及ぶ|d.高周波装置は自動制御可能な切開モードが主流である|e.切開方向は11時〜12時方向である,a&d&e,ESTの偶発症には出血、穿孔、膵炎がある。結石再発は晩期偶発症。切開方向は乳頭の11-12時方向が安全域とされる。
食道静脈瘤の所見として、赤色所見（red color sign）RC3の所見はどれか。,臨床,a.発赤所見なし|b.線状の発赤（Red wale marking）|c.血豆様発赤（Cherry red spot）|d.全周性の発赤|e.結合織性被膜,d,RCサインの重症度分類において、RC0はなし、RC1は限局性、RC2は全周性でない散在性、RC3は全周性の赤色所見を指す（取り扱い規約によるが、選択肢から全周性が最も重度）。
内視鏡的止血法において正しい効果判定はどれか。,処置,a.直腸からびまん性出血に圧迫法は効果的である|b.動脈性出血には圧迫止血の第一選択である|c.高周波焼灼術は熱凝固法である|d.組織接着法がクリップ法に比べ大きい|e.止血鉗子は再出血予防に有効である,c,高周波凝固やAPCは熱凝固法に分類される。びまん性出血には圧迫やAPC、動脈性にはクリップや高周波鉗子が用いられる。
大腸ステントを挿入するための適応として正しいものはどれか。,処置,a.良性疾患による狭窄|b.悪性腫瘍による閉塞症状の緩和（BTS/Palliative）|c.穿孔を伴う閉塞|d.腹膜炎のある症例|e.予防的留置,b,大腸ステントは、大腸癌などの悪性腫瘍による閉塞症状の緩和（姑息的治療）や、手術までの待機期間の減圧（BTS: Bridge to Surgery）に適応となる。良性狭窄や穿孔例は原則禁忌。
感染性心内膜炎の予防として、抜歯や内視鏡的処置の際に抗菌薬投与を推奨する対象疾患はどれか。,管理,a.人工弁置換術後|b.チアノーゼ性先天性心疾患|c.感染性心内膜炎の既往|d.心臓移植後の弁膜症|e.すべて,e,循環器学会ガイドライン等では、人工弁、感染性心内膜炎の既往、未修復の先天性短絡性心疾患（チアノーゼ性）などは高リスク群とされ、出血を伴う処置の際に予防的抗菌薬投与が推奨される。
アルゴンプラズマ凝固法について誤りはどれか。,機器,a.対極板を必要とする|b.非接触で広い面を深く凝固できる|c.レーザー発生装置は用いない|d.毛細血管拡張症に有用である|e.専用のプローブが必要である,b,APCは「浅く」均一に凝固できるのが特徴であり、深く凝固して穿孔するリスクが低い。モノポーラなので対極板は必要。
小腸で消化吸収される栄養素のうち、胸管を通って輸送されるのはどれか。,基礎,a.アミノ酸|b.中性脂肪（脂肪酸）|c.ブドウ糖|d.電解質|e.水溶性ビタミン,b,脂肪（中性脂肪）は分解後、リンパ管（乳び管）に入り、胸管を経て静脈角から血液中に合流する。糖やアミノ酸は門脈を通って肝臓へ行く。
次のうち非上皮性腫瘍はどれか。2つ選べ。,臨床,a.食道乳頭腫|b.悪性リンパ腫|c.大腸癌|d.胃腺腫|e.消化管間質腫瘍（GIST）,b&e,癌や腺腫、乳頭腫は上皮性腫瘍（粘膜表面から発生）。GIST、悪性リンパ腫、平滑筋腫などは非上皮性腫瘍（粘膜下層以下の組織から発生）である。
抗血栓薬のうち直接作用型経口抗凝固薬（DOAC）はどれか。,薬理,a.アスピリン|b.エドキサバン|c.クロピドグレル|d.ワルファリンカリウム|e.イコサペント酸エチル,b,エドキサバン、リバーロキサバン、ダビガトランなどはDOAC。アスピリン、クロピドグレルは抗血小板薬。ワルファリンはビタミンK拮抗薬。
胃潰瘍について誤りはどれか。,基礎,a.胃潰瘍は消化性潰瘍に含まれる|b.ヘリコバクター・ピロリ菌との関連性がある|c.進行胃癌は胃内視鏡的粘膜下層剥離術の適応である|d.喫煙と関連性がある|e.非ステロイド性抗炎症薬（NSAIDs）の合併症として消化性潰瘍がある,c,進行胃癌（筋層以深への浸潤）は内視鏡治療（ESD）の適応外であり、外科手術が必要。ESDはリンパ節転移のない早期癌が適応。
閉塞性黄疸が高値になる。特に、悪性度の高い腫瘍閉塞ではその傾向が強い。関連する検査値はどれか。,臨床,a.急性閉塞性化膿性胆管炎|b.下部胆管癌|c.膵頭部癌|d.肝硬変|e.直接ビリルビン,e,閉塞性黄疸では胆汁排泄障害により「直接ビリルビン」が優位に上昇する。疾患名ではなく検査項目を問うているならビリルビン。
